term,definition,source
ประชาชน (Citizen),บุคคลผู้มีสัญชาติไทยตามกฎหมายว่าด้วยสัญชาติและบุคคลผู้มีชื่ออยู่ในทะเบียนบ้านตามระเบียบ,พ.ร.บ.การทะเบียนราษฎรพ.ศ.2534
หมายเลขบัตรประชาชน (National ID),เลขประจำตัวประชาชน 13 หลักที่กรมการปกครองออกให้เพื่อใช้ยืนยันตัวตนในการติดต่อราชการ,กรมการปกครอง กระทรวงมหาดไทย
ที่อยู่ปัจจุบัน (Current Address),สถานที่ที่บุคคลพักอาศัยอยู่เป็นประจำในปัจจุบัน และสามารถติดต่อได้จริงผ่านทางไปรษณีย์,ฐานข้อมูลทะเบียนราษฎร
เบอร์โทรศัพท์ (Phone Number),หมายเลขโทรศัพท์ 9-10 หลักที่สามารถติดต่อบุคคลนั้นๆ ได้โดยตรงและยังใช้งานได้จริงในปัจจุบัน,ผู้ให้ข้อมูล (ประชาชนตอนลงทะเบียน)
สัญชาติ (Nationality),ความผูกพันตามกฎหมายระหว่างบุคคลกับรัฐที่บุคคลนั้นมีสัญชาติอยู่ตามกฎหมายของรัฐนั้นๆ,กรมศุลกากร / สำนักงานตรวจคนเข้าเมือง
